id,created_at,category,title,description,source,content,ai_summary,ai_title,url
119,2026-04-10 21:53:38.140306+00,sports,"Masters 2026 Round 1 live updates, leaderboard: Rory McIlroy is making a move - Yahoo Sports",The 90th playing of the Masters is officially here.,Yahoo Entertainment,"The 90th edition of the Masters is officially here.
 Jack Nicklaus, Gary Player and Tom Watson hit the ceremonial opening tee shots at Augusta National this morning, kicking off the first major champ… [+9458 chars]","The 2026 Masters has delivered a compelling mix of elite competition and nostalgic brilliance, highlighted by 60-year-old José María Olazábal turning back the clock at Augusta National. The two-time Masters champion briefly surged near the top of the leaderboard early in the tournament, showcasing his experience and precision against a field dominated by younger, power-hitting players. His performance stood out as a reminder that course knowledge and shot-making can still compete with modern distance-focused golf.
 

 While Olazábal’s run captured attention, the broader tournament remains highly competitive, with top players battling for position heading into the later rounds. Established stars and emerging talents alike are navigating Augusta’s challenging layout, where consistency and composure are proving critical.
 

 The event also highlights the evolving nature of the sport, as seasoned veterans like Olazábal continue to inspire alongside a new generation of players. His showing, even if not sustained through all rounds, adds a unique narrative to the tournament — blending history, resilience, and the enduring appeal of the Masters.",60-Year-Old José María Olazábal Defies Age at Masters as Leaderboard Drama Unfolds,https://sports.yahoo.com/golf/live/masters-2026-leaderboard-tee-times-how-to-watch-60-year-old-jose-maria-olazabal-turning-back-the-clock-113000052.html
120,2026-04-10 21:53:38.140306+00,sports,Poll: Is Jordan Walker Finally Breaking Out? - MLB Trade Rumors,Jordan Walker is off to a blistering start for the Cardinals this year. How much of it is real? Vote now in MLBTR's latest poll!,MLB Trade Rumors,"It might not seem like it, but it was just a few years ago that Jordan Walker was a consensus top five prospect in all of baseball. Walker entered the 2023 season as a trendy Rookie of the Year pick … [+4791 chars]","St. Louis Cardinals outfielder Jordan Walker, once a consensus top-five prospect in all of baseball, is off to one of the most electric starts in the majors in 2026, reigniting debate about whether the 23-year-old is finally realizing his enormous potential. After two brutal seasons where he combined for a .211/.270/.324 slash line and a 68 wRC+ across 574 plate appearances, Walker has turned heads with a .295/.367/.682 line and five home runs through just 49 plate appearances, good for a 191 wRC+.
 Encouragingly, the underlying metrics support the performance. His .320 BABIP is close to his career average, his 10.2% walk rate is a career best, and his .453 xwOBA closely mirrors his actual production. His 23.3% barrel rate borders on elite.
 However, meaningful concerns remain. Walker's 28.6% strikeout rate is still very high, making sustained success more difficult. Previous short hot streaks — including a .342/.419/.500 stretch in July 2025 — faded quickly, serving as a cautionary reminder about small sample sizes.
 Cardinals coaches publicly challenged Walker late last season over his preparation habits, and the apparent response has been tangible swing improvements, including better launch angle, a lower chase rate, and improved plate discipline. An MLB Trade Rumors reader poll reflects cautious optimism, with 61% believing Walker will settle into solid regular status rather than becoming a top-30 hitter or reverting to prior struggles.Sonnet 4.6","Cardinals' Jordan Walker Posts Blazing Start to 2026, But Can He Sustain It?",https://www.mlbtraderumors.com/2026/04/poll-is-jordan-walker-finally-breaking-out.html
121,2026-04-10 21:53:38.140306+00,technology,Castlevania: Belmont's Curse Let's You Fight Joan Of Arc And Explore Notre Dame In New Trailer - Nintendo Life,"Bonjour, evildoers",Nintendo Life,"Today's Triple-i Initiative showcase promised us some Castlevania: Belmont's Curse news, and we got a little bit of that during today's presentation.
 In the short new trailer up top, featuring comme… [+1015 chars]","A new trailer for Castlevania: Belmont's Curse debuted at the Triple-i Initiative showcase, offering fans a closer look at the game's Parisian setting and combat. Developed by Evil Empire — the studio behind Dead Cells — the footage confirms Notre Dame Cathedral as an explorable location and reveals a dramatically corrupted version of Joan of Arc as a boss enemy.
 The game is set in Paris and takes place 23 years after Castlevania: Dracula's Curse, with a whip-wielding Belmont protagonist at its center. Developer Evil Empire was keen to reiterate that despite their roguelike pedigree, Belmont's Curse is a traditional Metroidvania experience true to the classic Castlevania formula, not a roguelike or roguelite.
 No release date or launch window was confirmed during the showcase, though the game is slated for Nintendo Switch and PS5 in 2026. Fan reaction has been overwhelmingly positive, with many praising the visual style, combat animations, and the bold decision to feature a historically corrupted Joan of Arc as a key antagonist. The trailer also highlighted the game's RPG elements, which appear to have been faithfully preserved for longtime series fans.",Castlevania: Belmont's Curse Trailer Reveals Corrupted Joan of Arc Boss and Notre Dame Setting,https://www.nintendolife.com/news/2026/04/castlevania-belmonts-curse-lets-you-fight-joan-of-arc-and-explore-notre-dame-in-new-trailer
122,2026-04-10 21:53:38.140306+00,technology,"One Of The Best Stardew Valley -Likes Ever Is 100% Free On Steam, But Only For A Few Days - Kotaku",,Kotaku,Description: Group Number: Group Name: Ip Address: Username: Computer Name:,"To mark the announcement of Graveyard Keeper 2 at the Triple-I indie showcase on April 9, publisher tinyBuild has made the original Graveyard Keeper completely free on Steam until April 13. The game, which first launched in 2018, is a darkly humorous medieval cemetery management simulator that tasks players with running a graveyard, handling daily deliveries of corpses, and keeping the whole operation afloat.
 Widely regarded as one of the best games to follow in Stardew Valley's footsteps, Graveyard Keeper was openly inspired by both Stardew Valley and Harvest Moon, as confirmed by the developers themselves. It stands out among the many life-sim clones for its robust systems, quirky tone, and extensive DLC offerings. The game also runs well on Steam Deck and supports a healthy selection of community mods.
 The newly announced Graveyard Keeper 2 is expected to launch later in 2026 on PC, PS5, Xbox Series X/S, Nintendo Switch, and Switch 2. For anyone curious about the series, the free offer on the original is an ideal entry point before the sequel arrives.",Graveyard Keeper Is Free on Steam Until April 13 to Celebrate Sequel Announcement,https://kotaku.com/graveyard-keeper-stardew-valley-free-steam-april-sequel-steam-deck-2000686355
159,2026-04-10 23:13:25.252785+00,business,Futures: Trump Issues Hormuz Threat; Amazon Fuels AI Trade - Investor's Business Daily,"Iran talks, CPI inflation, Taiwan Semi are on tap.",Investor's Business Daily,"Information in Investors Business Daily is for informational and educational purposes only and should not be construed as an offer, recommendation, solicitation, or rating to buy or sell securities. … [+1064 chars]","U.S. stock markets closed mixed on April 10, 2026, as investors weighed surging inflation driven by the ongoing U.S.-Iran conflict against strong semiconductor earnings ahead of weekend peace talks. The Dow Jones fell 269 points while the Nasdaq gained 0.35%, bolstered by chipmakers. Despite the choppy session, all three major indexes posted solid weekly gains, with the S&P 500 up more than 3% for the week.
 March CPI rose 0.9% month-over-month — the largest monthly gain since 2022 — pushing annual inflation to 3.3%, as gasoline prices surged 21% following Iran's blockade of the Strait of Hormuz. However, core CPI, excluding food and energy, came in below expectations at 0.2%, offering some relief.
 Taiwan Semiconductor Manufacturing rose over 2% after reporting a 35% jump in first-quarter revenue, reinforcing strong AI-driven chip demand from customers including Nvidia and Apple. CoreWeave shares also surged after announcing a multi-year cloud deal with Anthropic.
 Markets remained cautious ahead of U.S.-Iran peace talks scheduled for the weekend in Islamabad, with the fragile two-week ceasefire under pressure. Consumer sentiment hit a record low, and inflation expectations climbed to 4.8%, complicating the Federal Reserve's path toward rate cuts.",Markets Mixed as Iran War Drives CPI to 4-Year High While TSMC Earnings Boost Semiconductor Stocks,https://www.investors.com/market-trend/stock-market-today/dow-jones-futures-iran-war-talks-cpi-inflation-nvidia-chipmaker-taiwan-semiconductor/
160,2026-04-10 23:13:25.252785+00,business,Nvidia’s stock is quietly gaining steam — it’s on its longest winning streak since 2023 - MarketWatch,"The stock trades meaningfully below its 52-week high, suggesting to one analyst that it could see sustained gains if the AI trade comes back alive",MarketWatch,"Nvidias stock has awakened from its slumber, clocking its seventh consecutive day of gains. 
 The stock is up 11.4% over that stretch, its longest winning streak since Nov. 14, 2023, according to Dow… [+70 chars]","Nvidia shares rose for eight consecutive sessions through April 10, 2026, marking the chipmaker's longest winning streak since November 2023 and adding approximately 11% to the stock over that stretch. The rally was driven by a combination of easing geopolitical tensions tied to the U.S.-Iran ceasefire, renewed confidence in AI infrastructure spending, and a softer-than-expected core inflation reading that broadly lifted tech stocks.
 Despite the run, Nvidia remains roughly 13-14% below its 52-week high and is still slightly negative for the year, suggesting the gains reflect a recovery from oversold levels rather than a breakout. The stock has traded in a range of approximately $165 to $195 for several months. Nvidia's $165 support level has held across multiple tests, reinforcing the underlying trend.
 The broader semiconductor sector has outperformed Nvidia in 2026, with the VanEck Semiconductor ETF up 19% year-to-date. Rival Intel surged around 50% over the same seven-session period. Investors remain focused on whether large cloud providers will sustain elevated AI capital expenditures, which continues to be the key variable underpinning Nvidia's long-term investment case.",Nvidia Posts Longest Winning Streak Since 2023 But Remains Below All-Time High,https://www.marketwatch.com/story/nvidias-stock-is-quietly-gaining-steam-its-on-its-longest-winning-streak-since-2023-9066742f
161,2026-04-10 23:13:25.252785+00,business,North Sea oil prices hit record high as Iran keeps hold over Strait of Hormuz - Financial Times,Washington-Tehran ceasefire agreement fails to stem global energy crunch,Financial Times,Then $75 per month. Complete digital access to quality FT journalism on any device. Cancel anytime during your trial.,"North Sea oil prices have surged to an unprecedented record high, reflecting escalating geopolitical tensions and supply concerns in the global energy market. A primary contributing factor is Iran's continued strategic control over the Strait of Hormuz, a vital chokepoint for a significant portion of the world's oil shipments. Despite a recently brokered ceasefire agreement between Washington and Tehran, hopes that this diplomatic breakthrough would alleviate the burgeoning global energy crunch have been dashed. The failure of this accord to stabilize the market underscores the deep-seated complexities and persistent volatility affecting international oil prices. Analysts attribute the sustained upward pressure on prices to the inherent risks associated with shipping through the Strait, coupled with broader supply-demand imbalances. This situation highlights the fragile nature of global energy security, where geopolitical leverage in key maritime passages can have immediate and dramatic impacts on crude benchmarks worldwide, signaling potential economic headwinds for consumers and industries alike.",North Sea Oil Prices Soar to Record High Amid Iran's Strait of Hormuz Grip,https://www.ft.com/content/f04ad855-81e3-49c5-827e-d3c4acb901c9?syn-25a6b1a6\\u003d1
162,2026-04-10 23:13:25.252785+00,entertainment,Selling the O.C.' Future Unknown as Production Takes Backseat to 'Selling Sunset' - TMZ,"Trouble may be brewing in the O.C. ... the cast of Netflix's ""Selling the O.C."" has been notified they won't be filming this year, TMZ has learned.",TMZ,"Trouble may be brewing in Orange County ... the cast of Netflix's ""Selling the O.C."" has been notified they won't be filming this year ... TMZ has learned.
 Sources close to production tell TMZ ... t… [+1083 chars]","The future of Netflix's reality series 'Selling the O.C.' appears uncertain as its cast has been informed that production will not resume this year. Sources close to the show's development revealed to TMZ that filming has been halted, casting significant doubt on the show's continuation. This decision reportedly stems from a strategic shift by Netflix and production to prioritize its flagship series, 'Selling Sunset,' over its Orange County spin-off. While the series has not been officially canceled, the indefinite delay in filming suggests a significant pause or potential hiatus for the show, which initially premiered to much fanfare. This news comes as a surprise to fans and cast members alike, who were expecting to return for another season. The heightened focus on 'Selling Sunset' indicates the streamer is concentrating resources on its more established and popular real estate reality franchise, leaving the O.C. agents in limbo regarding their on-screen future and whether they will ever return to film new episodes.",Selling the O.C.' Future Unknown as Production Takes Backseat to 'Selling Sunset',https://www.tmz.com/2026/04/09/selling-the-oc-production-stalled-for-sunset/
163,2026-04-10 23:13:25.252785+00,entertainment,"CBS: 'Eternally Yours' Comedy Series Order, 'The Tillbrooks' Gets Pass - Deadline","CBS has picked up one of its two comedy pilots, Eternally Yours, to series while passing on the other, The Tillbrooks (fka Regency).",Deadline,"CBS has made the final scripted programming decision ahead of revealing its 2026-27 schedule next week. The network said Thursday it has picked up one of its two comedy pilots,Eternally Yours, to ser… [+2984 chars]","CBS has finalized its scripted programming decisions by ordering the comedy pilot 'Eternally Yours' to series, while simultaneously passing on its other comedy pilot, 'The Tillbrooks,' which was formerly known as 'Regency.' This strategic move comes as the network prepares to unveil its full 2026-27 schedule next week. 'Eternally Yours' was one of two highly anticipated comedy projects that CBS had in contention, and its selection signifies the network's confidence in its premise and potential to attract viewers. The decision to greenlight 'Eternally Yours' underscores CBS's commitment to refreshing its comedy lineup and investing in new narratives. Conversely, 'The Tillbrooks' will not proceed, concluding its pilot phase. These announcements are crucial in shaping the network's future programming slate, indicating the direction CBS intends to take with its upcoming comedy offerings and competitive broadcast strategy for the new television season. The industry will closely watch how 'Eternally Yours' performs and integrates into CBS's established schedule.","CBS Orders 'Eternally Yours' Comedy Series, Passes on 'The Tillbrooks'",http://deadline.com/2026/04/cbs-eternally-yours-comedy-series-the-tillbrooks-pilot-dead-1236786163/
164,2026-04-10 23:13:25.252785+00,entertainment,Nikki Glaser is OK with her boyfriend hooking up with other women. Why some experts say these relationships can totally work. - Yahoo,"As non-monogamy becomes more visible in pop culture, experts explain what people often misunderstand about open relationships and why communication and...",Yahoo Entertainment,"Nikki Glaser would be totally OK with her boyfriend, TV producer Chris Convy, hooking up with other women.
 In a relationship, I don't really care if my boyfriend were to hook up [with others],"" Glas… [+6641 chars]","Comedian Nikki Glaser openly states her comfort with boyfriend Chris Convy engaging with other women, reflecting a growing visibility of non-monogamous relationships in contemporary culture. This article explores why some experts believe such open relationships can be highly successful, often debunking common misconceptions. Experts emphasize that the key to thriving non-monogamous dynamics isn't a lack of commitment or emotion, but rather an elevated level of honest communication, clear boundaries, and mutual consent. They highlight that these relationships require partners to openly discuss desires, insecurities, and expectations, fostering a deeper understanding and trust. Misconceptions often include the belief that open relationships are solely about sex, or that they are a sign of a failing primary relationship. In reality, proponents argue they can strengthen bonds and promote individual growth when approached with transparency and respect, challenging traditional relationship paradigms.",Nikki Glaser OKs Boyfriend's Hookups; Experts Explain How Open Relationships Can Work,https://www.yahoo.com/lifestyle/family-relationships/article/nikki-glaser-is-ok-with-her-boyfriend-hooking-up-with-other-women-why-some-experts-say-these-relationships-can-totally-work-221918556.html
165,2026-04-10 23:13:25.252785+00,general,Justice Department opens antitrust probe into NFL broadcasting deals - The Washington Post,"The Justice Department is investigating whether the NFL has engaged in anticompetitive practices, amid growing fan frustration over the airing of games on subscription TV services.",The Washington Post,"The Justice Department has launched an investigation into whether the National Football League has engaged in anticompetitive practices, amid growing frustration from fans over the leagues increasing… [+178 chars]","The U.S. Justice Department has initiated an antitrust investigation into the National Football League's broadcasting practices, prompted by significant fan frustration. This discontent stems from the league's increasing reliance on subscription-based streaming services and pay-TV channels, making it challenging and expensive for many to watch games without multiple subscriptions. The probe will examine if the NFL's current deals for distributing game broadcasts violate antitrust laws by limiting competition and potentially harming consumers. Critics argue that the fragmented broadcast landscape, with games spread across platforms like Peacock, Amazon Prime Video, and ESPN+, forces fans into numerous costly subscriptions, diminishing the sport's accessibility. This inquiry signals a serious government step to scrutinize how major sports leagues manage media rights and whether these arrangements prioritize profit over fan experience and fair market practices, potentially leading to major changes in future NFL game distribution.",Justice Department Investigates NFL Broadcasting Deals for Antitrust Concerns,https://www.washingtonpost.com/national-security/2026/04/09/nfl-football-games-antitrust-investigation/
166,2026-04-10 23:13:25.252785+00,general,"Pentagon violated court order to restore press access, judge rules - The Washington Post","Senior U.S. District Judge Paul L. Friedman also admonished the Trump administration, saying suppressing political speech is the “mark of an autocracy, not a democracy.”",The Washington Post,"A federal judge in Washington ruled Thursday that the Pentagon violated his order to restore access for New York Times journalists, finding that the Defense Departments revised interim policy unconst… [+151 chars]","A federal judge in Washington D.C., Senior U.S. District Judge Paul L. Friedman, ruled that the Pentagon violated his previous order to restore press access for journalists from The New York Times. The judge found that the Defense Department's revised interim policy regarding press access was unlawful, leading to the violation. This ruling came after the Pentagon implemented new policies that restricted access, prompting legal action. Judge Friedman strongly admonished the Trump administration during his ruling, stating that the suppression of political speech is characteristic of an autocracy, not a democracy. The decision underscores ongoing tensions between the administration and the press, affirming the importance of a free press and government transparency. The court's finding emphasizes the judiciary's role in upholding constitutional rights against executive overreach, particularly concerning access for legitimate news organizations. This judgment requires the Pentagon to comply with the original order and cease its restrictive practices against the New York Times.","Pentagon violated court order to restore press access, judge rules",https://www.washingtonpost.com/business/2026/04/09/judge-pentagon-press-access/
168,2026-04-10 23:13:25.252785+00,health,Jury awards $49M to Darien woman whose doctor missed likely fatal cancer - CT Insider,A jury awarded $49 million to a Darien woman with terminal cervical cancer who sued her doctor for failing to follow up on high-risk HPV results.,Ctinsider.com,"From left: Attorney Sarah Russell, Plaintiff Daniel Anderson, Plaintiff Jennifer Anderson, and Attorney Peter Dreyer outside state Superior Court in Stamford April 9, 2026. 
 Contributed / Silver Gol… [+3696 chars]","A jury awarded Jennifer Anderson, a Darien woman with terminal cervical cancer, $49 million in a malpractice lawsuit against Westmed Medical Group. Anderson sued her doctor, Dr. Elizabeth McDonald, for failing to follow up on high-risk HPV test results from 2020. This negligence prevented early detection and treatment, leading to her cancer being diagnosed at an advanced, incurable stage. The lawsuit highlighted that standard procedures, such as a colposcopy, could have identified the cancer when it was treatable. The verdict, delivered in Stamford's state Superior Court, covers medical expenses, lost earning capacity, and immense pain and suffering. Attorneys Sarah Russell and Peter Dreyer represented Anderson, arguing that the doctor's failure to adhere to medical protocols directly resulted in her devastating prognosis. This significant ruling provides justice and financial security for Anderson's future care, underscoring the severe consequences of medical negligence in crucial preventative healthcare.",Jury awards $49M to Darien woman whose doctor missed likely fatal cancer,https://www.ctinsider.com/news/article/darien-jennifer-anderson-cancer-lawsuit-westmed-22197920.php
171,2026-04-10 23:13:25.252785+00,science,"As Artemis II heads back to Earth, crew is staking their lives on the heat shield - CBS News","Despite problems during the unpiloted Artemis I reentry, the Artemis II crew is confident their heat shield will protect them during a fiery descent to Earth.",CBS News,"When the Artemis II Orion crew capsule returns to Earth on Friday after flying around the moon, it will hit the discernible atmosphere some 75 miles above the Pacific Ocean at a blistering 24,000 mph… [+9797 chars]","The Artemis II mission is rapidly approaching its most perilous phase: the return to Earth. After successfully circumnavigating the moon, the Orion crew capsule will confront a blistering reentry into our planet's atmosphere. Astronauts onboard are placing their ultimate trust in the integrity of the capsule's sophisticated heat shield. This vital component must withstand extreme temperatures and atmospheric friction as the spacecraft plunges at speeds reaching a staggering 24,000 mph. The descent, anticipated to occur on a Friday, involves hitting the discernible atmosphere some 75 miles above the Pacific Ocean. The heightened scrutiny on the heat shield stems from prior issues observed during the unpiloted Artemis I mission's reentry, which revealed unexpected charring. Despite these previous challenges and the inherent risks of such high-speed atmospheric braking, the Artemis II crew maintains strong confidence in the reliability and enhanced design of their heat shield. They are fully prepared and trusting its capability to protect them through the intense, fiery descent, marking the final, critical step towards their safe return from deep space. Their very lives are staked on the flawless performance of this engineering marvel.",Artemis II Crew Stakes Lives on Heat Shield for Fiery Earth Reentry,https://www.cbsnews.com/news/artemis-ii-return-earth-heat-shield-reentry/
