id,created_at,category,title,description,source,content,ai_summary,ai_title,url
105,2026-04-10 21:53:38.140306+00,business,Is Anthropic limiting the release of Mythos to protect the internet — or Anthropic? - TechCrunch,"Anthropic said this week that it limited the release of its newest model, dubbed Mythos, because it is too capable of finding security exploits in software relied upon by users around the world. Are real cybersecurity concerns a cover for a bigger problem at …",TechCrunch,"Anthropic said this week that it limited the release of its newest model, dubbed Mythos, because it is too capable of finding security exploits in software relied upon by users around the world.
 Ins… [+3830 chars]","Anthropic’s decision to limit the release of its powerful new AI model, Mythos, has sparked debate over whether the move is primarily about protecting global cybersecurity or safeguarding the company’s strategic interests. The model has demonstrated an extraordinary ability to identify and exploit software vulnerabilities across widely used systems, raising concerns that public access could enable large-scale cyberattacks.
 

 To mitigate these risks, Anthropic has opted for a controlled rollout under its “Project Glasswing” initiative, granting access only to a select group of trusted organizations focused on defensive cybersecurity. This approach allows vulnerabilities to be discovered and patched before malicious actors can exploit them. However, critics question whether restricting access also consolidates power among a small group of major tech players, potentially shaping the competitive landscape of AI.
 

 The situation highlights a broader dilemma in AI development: as models become increasingly capable, companies must balance openness with safety. Anthropic’s cautious strategy may set a precedent for future AI releases, where limiting access becomes a necessary step to manage real-world risks while navigating competitive pressures.",Anthropic’s Mythos: Safety-Driven Restraint or Strategic Control of a Powerful AI?,https://techcrunch.com/2026/04/09/is-anthropic-limiting-the-release-of-mythos-to-protect-the-internet-or-anthropic/
106,2026-04-10 21:53:38.140306+00,business,Big Short' investor Michael Burry says Anthropic is 'eating Palantir's lunch' as enterprise AI spending shifts - Business Insider,Palantir's stock is down. Michael Burry said Wednesday that Anthropic's rapid rise is a threat to Palantir as enterprise AI spending shifts.,Business Insider,"Michael Burry has long been bearish on Palantir, but he recently shared a new take on the market's AI darling, comparing its prospects to another titan in the space.
 Anthropic isn't publicly traded … [+2692 chars]","Investor Michael Burry has reignited concerns about the AI boom, arguing that the market may be overvaluing certain tech companies while underestimating newer AI players. In particular, he criticized Palantir Technologies, claiming that rival Anthropic is rapidly outperforming it in the enterprise AI space.
 

 Burry pointed to Anthropic’s explosive growth, with its annual recurring revenue reportedly jumping from around $9 billion to $30 billion, driven by demand for its simpler and more cost-effective AI tools. This surge reflects a broader shift in corporate spending toward AI platforms that deliver immediate productivity gains, rather than complex infrastructure-heavy solutions.
 

 Following his comments, Palantir’s stock dropped sharply, highlighting how sensitive investors remain to competitive pressures in the AI sector. Burry’s stance also aligns with his broader skepticism about an “AI bubble,” suggesting that hype may be masking fundamental weaknesses in some companies.
 

 Overall, the episode underscores a changing landscape in AI, where usability and scalability may matter more than legacy positioning, and where emerging players like Anthropic could reshape the competitive hierarchy.",Michael Burry Warns AI Trade Is Overhyped as Anthropic Surges Past Palantir,https://www.businessinsider.com/michael-burry-anthropic-palantir-short-ai-stocks-tech-pltr-claude-2026-4
108,2026-04-10 21:53:38.140306+00,entertainment,Actress Janel Parrish & Husband Chris Long Separate - TMZ,Janel Parrish and her husband Chris Long have split up ... TMZ has learned.,TMZ,"Janel Parrish and her husband Chris Long have split up ... TMZ has learned.
 Sources with direct knowledge tell TMZ ... the Hallmark star and her man have been separated for a few months.
 Parrish an… [+758 chars]","Actress Janel Parrish and her husband Chris Long have reportedly separated after several years of marriage, marking a new chapter in their relationship. According to TMZ, the couple has been living apart for a few months, though neither has publicly commented in detail on the split.
 

 Parrish and Long began dating in 2016, got engaged a year later, and tied the knot in a 2018 ceremony in Hawaii. Over the years, they maintained a relatively private relationship, occasionally sharing moments from their life together on social media. However, fans had recently noticed fewer posts featuring the couple, fueling speculation about their status.
 

 Despite the separation, sources suggest there is no public conflict between the two, and their breakup appears to be amicable. Parrish continues to focus on her acting career, particularly her work in television and Hallmark films. The situation reflects a broader trend among celebrity couples navigating personal changes away from the spotlight while maintaining mutual respect and privacy.",Janel Parrish and Husband Chris Long Separate After Years of Marriage,https://www.tmz.com/2026/04/09/janel-parrish-and-husband-chris-long-broken-up/
109,2026-04-10 21:53:38.140306+00,entertainment,‘Metal Gear Solid’ Movie in the Works From ‘Final Destination’ Duo as They Ink Sony First-Look (Exclusive) - The Hollywood Reporter,"Zach Lipovsky and Adam B. Stein have become among the more in-demand filmmakers in town. Now, Sony has snapped them up for an expansive deal that will cover all of studio’s film labels.",Hollywood Reporter,"What a difference a Hollywood year can make.
 Just a year ago, Zach Lipovsky and Adam B. Stein were a filmmaking duo with humble indie horror roots, prepping to release their first sizeable feature, … [+3572 chars]","After more than a decade of delays, the long-awaited Metal Gear Solid movie adaptation is finally gaining real momentum, with directors Zach Lipovsky and Adam B. Stein now attached to lead the project. Backed by Sony Pictures, the film marks a renewed push to bring Hideo Kojima’s iconic stealth-action franchise to the big screen.
 

 Originally announced in 2014, the project has faced multiple setbacks, including script revisions and shifting creative direction. Earlier plans involved director Jordan Vogt-Roberts and actor Oscar Isaac as Solid Snake, but those iterations stalled, leaving the film in development limbo for years.
 

 The new directors, known for visually driven storytelling and suspense, have expressed strong enthusiasm for adapting the series, calling it a groundbreaking cinematic experience. Sony executives also highlighted their ability to handle complex narratives, suggesting confidence in this latest attempt.
 

 While no release date or casting details have been confirmed, the project’s revival signals a serious effort to finally deliver a faithful adaptation. For fans, it represents renewed hope that one of gaming’s most cinematic franchises may at last transition successfully to film.",‘Metal Gear Solid’ Movie Gains Momentum with New Directors After Years in Development,http://www.hollywoodreporter.com/movies/movie-news/metal-gear-solid-movie-works-1236560289/
110,2026-04-10 21:53:38.140306+00,entertainment,Cardi B Reached Out to Offset After Florida Shooting Amid Divorce - TMZ,Cardi B has put her bitter divorce battle aside after Offset was shot ... reaching out to her estranged husband as he recovered in a Florida hospital ... TMZ has learned.,TMZ,"Cardi Bhas put her bitter divorce battle aside after Offset was shot ... reaching out to her estranged husband as he recovered in a Florida hospital ... TMZ has learned.
 Sources with direct knowledg… [+843 chars]","Cardi B reportedly put aside her ongoing and often contentious divorce from Offset to check on him after he was shot outside a casino in Florida. According to TMZ, she reached out shortly after the incident to see how he was doing while he recovered in the hospital.
 

 Offset sustained a gunshot wound to the leg during the incident but was reported to be in stable condition, with injuries described as non-life-threatening. Despite their separation and unresolved divorce proceedings, Cardi’s outreach highlights a continued personal connection, particularly as the two share three children together.
 

 The shooting occurred outside the Seminole Hard Rock Hotel & Casino and followed an altercation, with authorities detaining individuals as part of the ongoing investigation. The situation underscores the complex relationship between the former couple, whose history has included multiple breakups and reconciliations.
 

 Overall, Cardi’s response reflects a moment of concern that transcends their differences, showing that personal ties can persist even amid public and legal conflicts.",Cardi B Reaches Out to Offset After Shooting Despite Ongoing Divorce,https://www.tmz.com/2026/04/09/cardi-b-in-contact-with-offset-following-shooting/
111,2026-04-10 21:53:38.140306+00,general,Netanyahu authorizes direct talks with Lebanon in potential boost to ceasefire efforts - AP News,Israeli Prime Minister Benjamin Netanyahu said he authorized direct negotiations with Lebanon aimed at disarming Iranian-backed Hezbollah militants and establishing relations between the neighbors. The two countries have technically been at war since Israel w…,Associated Press,"DUBAI, United Arab Emirates (AP) In a potential boost to Middle East ceasefire efforts, Israeli Prime Minister Benjamin Netanyahu said Thursday that he authorized direct negotiations with Lebanon as … [+8383 chars]","Israel has authorized direct negotiations with Lebanon in a significant diplomatic shift, marking a rare attempt to ease tensions between the two countries, which have technically remained at war for decades. The talks, expected to take place in Washington, are aimed at addressing the role of Hezbollah, including potential disarmament, and exploring the possibility of longer-term stability in the region.
 

 However, the initiative comes amid a highly fragile ceasefire involving the United States, Iran, and Israel, with ongoing violence threatening to derail diplomatic progress. Israeli airstrikes in Lebanon and Hezbollah’s retaliatory attacks continue to escalate tensions, raising doubts about whether negotiations can succeed.
 

 At the same time, broader geopolitical pressures complicate the situation. Iran’s involvement, disputes over the Strait of Hormuz, and disagreements over whether Lebanon is included in the ceasefire have all added to uncertainty.
 

 The talks represent a potential breakthrough but also highlight the deep challenges of balancing military conflict with diplomacy. Their outcome could play a critical role in determining whether the region moves toward de-escalation or further instability.",Israel Opens Direct Talks with Lebanon as Fragile Ceasefire Faces Growing Strain,https://apnews.com/article/iran-us-israel-trump-lebanon-april-9-2026-7760f88f183ed2a13a721057e31f3ce7
112,2026-04-10 21:53:38.140306+00,general,Melania Trump denies association with Jeffrey Epstein - Politico,"The first lady made the surprise statement at the White House, calling on Congress to hold a public hearing for victims.",Politico,"It was not immediately clear what images or statements she meant, but she said they had been circulating on social media for years. Be cautious about what you believe. These images and stories are co… [+3815 chars]","Melania Trump issued a rare public statement firmly denying any association with Jeffrey Epstein, pushing back against resurfaced allegations and online speculation. Speaking from the White House, she described claims linking her to Epstein as false and politically motivated, emphasizing that she had no involvement in his activities and was never part of his inner circle.
 

 Her remarks came after renewed scrutiny tied to previously released documents and references to past social interactions, including a limited number of encounters at events and an old email exchange with Ghislaine Maxwell. Melania dismissed these as insignificant and not indicative of any meaningful relationship.
 

 In addition to denying the allegations, she called for greater accountability by urging Congress to hold hearings where Epstein’s victims could testify publicly. This move was seen as an effort to shift focus toward justice for survivors while also addressing the controversy directly.
 

 The statement, unusual for a first lady, has reignited attention on the Epstein case and its connections to high-profile figures, while also highlighting the political sensitivity surrounding the issue.","Melania Trump Denies Epstein Ties in Rare Public Statement, Calls for Victim Testimony",https://www.politico.com/news/2026/04/09/melania-trump-denies-association-with-jeffrey-epstein-00865768
113,2026-04-10 21:53:38.140306+00,general,Sources: DOJ opens antitrust investigation of NFL over TV deals - ESPN,"The Justice Department has begun an investigation into whether the NFL has violated anticompetitive practices with their television contracts that require consumers to pay subscription costs to watch some games, sources confirmed to ABC News.",ESPN,"Apr 9, 2026, 03:00 PM ET
 The Justice Department has begun an investigation into whether the NFL has violated anticompetitive practices with its television contracts that require consumers to pay sub… [+5158 chars]","The U.S. Department of Justice has launched an antitrust investigation into the National Football League, focusing on whether its television and streaming deals unfairly limit competition and increase costs for consumers. The probe is examining the league’s media contracts, which increasingly require fans to subscribe to multiple platforms to watch games.
 

 At the center of the investigation is the NFL’s long-standing ability to collectively negotiate broadcast rights under the Sports Broadcasting Act of 1961. While this exemption applies to traditional broadcast TV, regulators are questioning whether it still holds in an era dominated by cable and streaming services.
 

 Critics argue that spreading games across platforms like Amazon Prime Video, Netflix, and ESPN has made it more expensive and complicated for fans to follow the sport, sometimes requiring multiple subscriptions. Meanwhile, the NFL maintains that most games remain available on free local broadcasts and that its model benefits both fans and media partners.
 

 The investigation could have significant implications for how sports media rights are structured, potentially reshaping the balance between accessibility, competition, and the rapidly evolving streaming ecosystem.",U.S. Justice Department Probes NFL Media Deals Over Antitrust Concerns,https://www.espn.com/nfl/story/_/id/48440303/sources-doj-opens-antitrust-investigation-nfl-tv-deals
114,2026-04-10 21:53:38.140306+00,health,How bad for humans is wildlife trade? A new study has answers - NPR,"People sell wild animals for food and for traditional medicine — legally and illegally. A study looks at the risks of spillover diseases from those pangolins, giant rats and other exotic critters.",NPR,"In 2003, a shipment of exotic African rodents to a pet store in Illinois sparked the United States' first mpox outbreak
 . Gambian giant rats and other rodents infected prairie dogs, which in turn in… [+5632 chars]","A growing body of research highlights how the global wildlife trade is significantly increasing the risk of dangerous pathogens spilling over from animals to humans, raising concerns about future pandemics. Scientists say that the trade—spanning exotic pets, food markets, and animal products—creates frequent and intense contact between humans and wildlife, providing ideal conditions for viruses and bacteria to jump species.
 

 A recent study analyzing decades of data found that animals involved in wildlife trade are far more likely to carry diseases that can infect humans compared to those not traded. The longer a species circulates in trade networks, the greater the number of pathogens it can transmit, compounding the risk over time.
 

 Experts emphasize that the highest-risk stages occur early in the supply chain—during hunting, transport, and handling—when animals are stressed and often kept in unsanitary conditions. These environments allow pathogens to spread rapidly across species and potentially reach humans.
 

 The findings reinforce concerns that wildlife trade has contributed to past outbreaks such as Ebola, HIV, and COVID-19, and underscore the urgent need for stronger global regulation, surveillance, and prevention strategies to reduce the likelihood of future health crises.","Global Wildlife Trade Is Accelerating Disease Spillover Risks, Scientists Warn",https://www.npr.org/2026/04/09/nx-s1-5776668/wildlife-trade-pathogens-spillover
115,2026-04-10 21:53:38.140306+00,health,2 rabies cases identified in Orange County from cat and raccoon - WRAL,The release stated that the first incident involving a raccoon happened on April 4 in the vicinity of Dixie Lane in Chapel Hill. The second incident involving a cat happened on April 7 near Holiday Park Road in Hillsborough.,WRAL.com,"Orange County Animal Services received two positive rabies tests, according to the North Carolina State Laboratory of Public Health. 
 The release stated that the first incident involving a raccoon h… [+2241 chars]","Orange County Animal Services has confirmed two positive rabies cases following incidents involving a raccoon and a domestic cat in North Carolina. The first case occurred on April 4 near Dixie Lane in Chapel Hill, where a raccoon bit a dog that is now under animal control treatment. The second incident took place on April 7 near Holiday Park Road in Hillsborough, where an outdoor cat bit a person who is currently receiving rabies prophylaxis treatment.
 Officials from the Orange County Health Department are evaluating exposure risks on a case-by-case basis. For vaccinated pets potentially exposed to rabies, a booster shot must be administered within 96 hours. Unvaccinated pets face either euthanasia or quarantine for up to four months.
 Authorities are reminding residents that all mammals can carry and transmit rabies, with raccoons, skunks, foxes, and bats being the most common carriers in North Carolina. Warning signs of rabies include aggressive or unusually friendly behavior, staggering, foaming at the mouth, and disorientation. Residents are urged to contact animal control immediately if they suspect any rabies exposure, and to call 911 if the incident occurs outside regular service hours.",Two Rabies Cases Confirmed in Orange County After Cat and Raccoon Incidents,https://www.wral.com/news/local/2-positive-rabies-tests-orange-county-april-9-2026/
116,2026-04-10 21:53:38.140306+00,science,Artemis II astronauts have fitness lessons for everyone - NPR,The Artemis II astronauts don't have a lot of space to exercise. That's why they've got the flywheel — a small device that can be used for strength and cardio workouts.,NPR,"Even a few days away from Earth can significantly alter the human body. Without the constant pull of gravity on the skeleton, muscle and bone can quickly atrophy. To combat this immediate physical de… [+4377 chars]","The four Artemis II astronauts aboard NASA's Orion spacecraft are using a compact exercise device called the flywheel to combat the rapid muscle and bone loss that occurs in microgravity. Even a few days without gravity can cause significant physical decline, particularly in the heart and skeletal muscles, making regular exercise critical during the mission.
 The flywheel, roughly the size of a large shoebox, works on a cable-and-resistance principle similar to a yo-yo — astronauts pull a handle to spin the device, generating resistance proportional to their effort. Despite its small size, it can simulate resistance equivalent to up to 400 pounds, allowing for exercises like squats, deadlifts, and curls, as well as cardiovascular workouts.
 The device was developed after years of research, including a NASA bed-rest study where over 10,000 volunteers applied to spend 70 days lying down — earning the nickname ""pillownauts."" Researchers found the flywheel prevented muscle atrophy as effectively as a full gym setup.
 Scientists believe the technology has broad applications beyond space travel, potentially helping elderly individuals combat age-related bone and muscle loss, and someday fitting neatly under a desk for everyday use.",How the Artemis II Crew's Flywheel Device Is Redefining Space Fitness for Everyone,https://www.npr.org/2026/04/09/nx-s1-5779671/artemis-flywheel-astronauts-resistance-workout-bone-loss
117,2026-04-10 21:53:38.140306+00,science,Scientists say the world’s oldest octopus fossil isn’t an octopus after all - AP News,"Scientists have found evidence that a 300-million-year-old sea creature previously thought to be the world's oldest octopus is actually a nautilus relative. University of Reading zoology lecturer Thomas Clements led the research, which found that the fossil, …",Associated Press,"LONDON (AP) A 300-million-year-old tentacled sea creature has lost its crown as the worlds oldest octopus, after scientists found evidence that its not an octopus at all.
 Newly published research co… [+3388 chars]","A fossil long celebrated as the world's oldest known octopus has been stripped of its title after scientists determined it is not an octopus at all. The specimen, known as Pohlsepia mazonensis and found at the Mazon Creek site in Illinois, had been listed in Guinness World Records as the earliest known octopus since its identification in 2000. New research published in the journal Proceedings of the Royal Society B concludes it is actually a relative of the modern nautilus.
 The breakthrough came when University of Reading zoologist Thomas Clements used synchrotron imaging — which generates X-rays using beams of light brighter than the sun — to scan inside the fossil rock. The technique revealed a radula, a ribbon-like feeding structure with at least 11 teeth per row. Octopuses have only seven or nine teeth per row, while nautiloids have 13, definitively ruling out an octopus classification.
 The misidentification is believed to have occurred because the creature decomposed and lost its distinctive shell before fossilisation, making it appear octopus-like. Guinness World Records has since removed the fossil's title. The finding pushes back the true origin of octopuses to the Jurassic period, and the Mazon Creek specimens now represent the oldest known nautiloid soft tissue in the fossil record.","300-Million-Year-Old ""World's Oldest Octopus"" Fossil Reclassified as Nautilus",https://apnews.com/article/oldest-octopus-fossil-mistaken-identity-nautilus-04d88f5cc171b1e93f24538e574838f9
118,2026-04-10 21:53:38.140306+00,sports,Barcelona complain to Uefa about 'grave lack of VAR intervention' in Atletico Madrid loss - BBC,"Barcelona submit a complaint to Uefa over a ""grave lack of VAR intervention"" during their Champions League defeat by Atletico Madrid on Wednesday.",BBC News,"Barcelona have submitted a complaint to Uefa over a ""grave lack of VAR intervention"" during their 2-0 Champions League defeat by Atletico Madrid on Wednesday.
 Hansi Flick's side were denied a penalt… [+1762 chars]","Barcelona have lodged an official complaint with UEFA following their 2-0 Champions League quarterfinal first leg defeat to Atletico Madrid at Camp Nou on April 8, 2026. The club's legal department filed the complaint the following day, focusing on a controversial incident in the 54th minute involving Atletico substitute Marc Pubill.
 The incident occurred when Atletico goalkeeper Juan Musso played a short goal-kick, bringing the ball into play. Pubill then handled the ball inside the penalty area, apparently unaware play had restarted. Referee Istvan Kovacs did not award a penalty and, crucially, VAR official Christian Dingert did not intervene — despite Pubill already being on a yellow card, meaning a second booking and sending-off should also have followed.
 Manager Hansi Flick was furious post-match, calling the non-decision unbelievable. Barcelona referenced a near-identical incident from a 2024 Champions League match between Club Brugge and Aston Villa, where a penalty was correctly awarded in the same circumstances.
 The club has requested a formal investigation, access to referee communications, and official acknowledgment of the error. While the result stands, Barcelona face a difficult second leg in Madrid needing to overturn a two-goal deficit.",Barcelona File Formal UEFA Complaint Over VAR Failure in 2-0 Champions League Loss to Atletico,https://www.bbc.com/sport/football/articles/cr41dq4pywxo
